Binturong,['Asia'],Animalia,Chordata,Mammalia,Carnivora,Viverridae,Arctictis,Arctictis binturong,"Fruit, Insects, Birds",Cub,Solitary,Declining,Habitat loss and capture,Long prehensile tail and sharp claws,"Bearcat, Asian Bearcat, Asian Civet",92 days,"Dense, moist tropical forest",Omnivore,2,Nocturnal/Crepuscular,Binturong,9.0,Throughout South-East Asia,Also known as the Asian Bearcat!,Mammal,BrownGreyBlack,Fur,15 mph,10 - 25 years,10kg - 14kg (22lbs - 31lbs),60cm - 96cm (24in - 38in),2 - 3 years,6 - 8 weeks,,"Human, Tigers, Snakes",,,,,,,,,,,,,,,,1,0,0
Bison,['North-America'],Animalia,Chordata,Mammalia,Artiodactyla,Bovidae,Bison,Bison Bison,,,,,,,,,Grass plains and forest,Herbivore,1,Herd,,,,Largest mammal in North America!,,BrownTan,Hair,22 mph,15 - 20 years,"1,000kg - 1,300kg (2,200lbs - 2,500lbs)",2m - 2.7m (6.6ft - 9ft),,,,"Human, Bear, Wolves",Mammal,,Huge head and a shoulder hump,,,,"Grass, Acorns, Berries",,,,Grass,,,,,1,0,0
Bloodhound,['Europe'],Animalia,Chordata,Mammalia,Carnivora,Canidae,Canis,Canis lupus,,,,,,,,,,Omnivore,7,,Bloodhound,,,"Affectionate, gentle and even-tempered!",Hound,BrownBlackTan,Hair,,,,,,,,,,,,"Kind, patient and noble",Should be trained from an early age due to their large size,,,,,,,,,,,0,1,0
Bluetick Coonhound,['North-America'],Animalia,Chordata,Mammalia,Carnivora,Canidae,Canis,Canis lupus,,,,,,,,,,Omnivore,7,,Bluetick Coonhound,,,Has an uncanny knack for problem-solving!,Hound,GreyBlueBlackWhite,Hair,,11-12 years,,,,,,,,,,Smart and brave,Should be trained from an early age due to their large size,,,,,,,,,,,0,1,0
Boggle,['North-America'],Animalia,Chordata,Mammalia,Carnivora,Canidae,Canis,Canis lupus,,,,,,,,,,Omnivore,,,,,,,,BlackWhiteTan,Hair,,10-13 years,65 lbs,,,,,,,,,"Strong, loving, and loyal",,,,,,,,,,,,0,1,0
Boglen Terrier,['North-America'],Animalia,Chordata,Mammalia,Carnivora,Canidae,Canis,Canis lupus,,,,,,,,,,Omnivore,,,,,,,,GreyBlackWhiteBrindle,Hair,,10-13 years,40 lbs,,,,,,,,,"Fun, friendly, and loyal",,,,,,,,,,,,0,1,0
Bolognese Dog,['Europe'],Animalia,Chordata,Mammalia,Carnivora,Canidae,Canis,Canis Lupus,,,,,,,,,,Omnivore,4,,Bolognese Dog,,,From the northern Italian city of Bologna!,Gun Dog,White,Hair,,,,,,,,,,,,"Devoted and lively, yet docile",Should be trained from an early age due to their hyperactive nature,,,,,,,,,,,1,0,0
Bongo,['Africa'],Animalia,Chordata,Mammalia,Artiodactyla,Bovidae,Tragelaphus,Tragelaphus eurycerus,"Leaves, Bark, Grasses",Calf,Solitary/Herd,"28,000",Habitat loss,10 - 15 white stripes on body,"Lowland Bongo, Mountain Bongo",9 months,Dense forests and bamboo thickets,Herbivore,1,Diurnal,Bongo,2.0,"Western, Eastern and Central Africa",Long and heavy spiralled horns!,Mammal,BrownRedBlackWhiteOrangeChestnut,Fur,43 mph,10 - 18 years,150kg - 220kg (330lbs - 484lbs),1.7m - 2.5m (5.5ft - 8.25ft),20 - 24 months,6 months,,"Leopards, Hyenas, Lions",,,,,,,,,,,,,,,,1,0,0
Bonobo,['Africa'],Animalia,Chordata,Mammalia,Primates,Hominidae,Pan,Pan paniscus,,Baby / infant,Troop,"Between 10,000 and 50,000",,,,"240 days, or 8 months",Lowland jungle and swamp forests,Omnivore,1,Troop,,1.0,,Shares 97% of the same DNA as humans!,,BrownGreyBlack,Hair,25 mph,Up to 40 years in a zoo or other captive setting.,25kg - 50kg (55lbs - 110lbs),,12 years,5 to 6 years,1,,Mammal,73cm - 90cm (29in - 35in),Large body size and opposable thumbs,,,,Small invertebrates and mammals,,,,Fruit,,,,,1,0,0
Border Collie,['Europe'],Animalia,Chordata,Mammalia,Carnivora,Canidae,Canis,Canis lupus,,,,,,,,,,Omnivore,6,,Border Collie,,,Highly intelligent and alert breed!,Herd,BrownRedBlackWhite,Hair,,12-15 years,,,,,,,,18-22 inches,,Lively and intelligent,Should be trained from an early age in obedience,,,,,,,,,,,0,1,0
Border Terrier,['Europe'],Animalia,Chordata,Mammalia,Carnivora,Canidae,Canis,Canis Lupus,,,,,,,,,,Omnivore,6,,Border Terrier,,,"Small, rough-coated breed of terrier!",Terrier,BrownGreyFawnBlackTan,Hair,,,,,,,,,,,,"Affectionate, brave and intelligent",Should be trained from an early age due to their hyperactive nature,,,,,,,,,,,1,0,0
Bordoodle,['North-America'],Animalia,Chordata,Mammalia,,,,,,,,,,,,,,Omnivore,,,,,,,,,,,,,,,,,,,,,,,,,,,,,,,,,1,0,0
Borkie,['North-America'],Animalia,Chordata,Mammalia,Carnivora,Canidae,Canis,Canis lupus,,,,,,,,,,Omnivore,,,,,,,,BrownBlackWhite,Hair,,10-13years,25 lbs,,,,,,,,,Lovable and energetic,,,,,,,,,,,,0,1,0
Boston Terrier,['North-America'],Animalia,Chordata,Mammalia,Carnivora,Canidae,Canis,Canis lupus,,,,,,,,,,Omnivore,4,,Boston Terrier,,,"Friendly, lovable and very strong!",Mastiff,BrownGreyRedBlackWhiteTan,Hair,,,,,,,,,,,,"Strong, friendly and devoted",Should be trained from an early age in a patient and understanding way,,,,,,,,,,,0,1,0
Bottlenose Dolphin,['Ocean'],Animalia,Chordata,Mammalia,Cetacea,Delphinidae,Tursiops,Tursiops Truncatus,,,,,,,,,Warm harbours and bays,Omnivore,1,Pod,,,,"Stays in groups from 15 to 2,000 in number!'",,Light GreyDark Grey,Smooth,21 mph,20 - 35 years,200kg - 300kg (440lbs - 660lbs),2.5m - 4m (8ft - 13ft),,,,"Human, Sharks, Killer Whale",Mammal,,Large dorsal fins and communicate using whistling,,,,"Fish, Shrimp, Squid",,,,Fish,,,,,1,0,0
Boxer Dog,['Europe'],Animalia,Chordata,Mammalia,Carnivora,Canidae,Canis,Canis lupus,,,,,,,,,,Omnivore,8,,Boxer Dog,,,"Bright, energetic and playful!",Mastiff,BrownBlackTan,Hair,,,,,,,,,,,,"Intelligent, fearless and strong",Should be trained from an early age due to their independent nature,,,,,,,,,,,0,1,0
Boxerdoodle,['North-America'],Animalia,Chordata,Mammalia,Carnivora,Canidae,Canis,Canis lupus,,,,,,,,,,Omnivore,,,,,,,,,,,,,,,,,,,,,,,,,,,,,,,,,0,1,0
Boxsky,['North-America'],Animalia,Chordata,Mammalia,Carnivora,Canidae,Canis,Canis lupus,,,,,,,,,,Omnivore,,,,,,,,GreyFawnBlackWhiteBrindle,Hair,,12-15 years,75 lbs,,,,,,,,,"Affectionate, energetic, and independent",,,,,,,,,,,,0,1,0
Boxweiler,['North-America'],Animalia,Chordata,Mammalia,Carnivora,Canidae,Canis,Canis lupus,,,,,,,,,,Omnivore,,,,,,,,BrownFawnBlackWhiteBrindle,Hair,,8 to 13 years,100 lbs,,,,,,,,,Energetic and protective,,,,,,,,,,,,0,1,0
British Timber,['Europe'],Animalia,Chordata,Mammalia,Carnivora,Canidae,Canis,Canis lupus,,,,,,,,,,Carnivore,,,British Timber,,,,,GreyBlackWhite,Hair,,10 to 14 years,,,,,,,,,,"Active, energetic, loyal, affectionate, and loving",,,,,,,,,,,,0,1,0
Brug,['North-America'],Animalia,Chordata,Mammalia,Carnivora,Canidae,Canis,Canis lupus,,Puppy,,,,,Grifon Pug,,,Omnivore,,,,,,,,BrownRedBlackWhite,Hair,,12-15 years,,,,,2-3,,Mammal,,,,,,,,,,,,,,,0,1,0
Brussels Griffon,['Europe'],Animalia,Chordata,Mammalia,Carnivors,Canidae,Canis,Canis lupus,,,,,,,,,,Omnivore,1-3 puppies,,,,,,,BrownRedBlueBlackTanBeige,Hair,,12-15 years,7-12 pounds,,,,,,,7-8 inches,,"Friendly, cheerful, curious, charming and affectionate.",,,,,,,,,,,,0,1,0
Bull Terrier,['Europe'],Animalia,Chordata,Mammalia,Carnivora,Canidae,Canis,Canis Lupus,,,,,,,,,,Omnivore,7,,Bull Terrier,,,Needs to be kept active!,Mastiff,BrownBlackWhiteTan,Hair,,,,,,,,,,,,Friendly and alert but stubborn,Should be trained from an early age due to their independent nature,,,,,,,,,,,1,0,0
Bulldog,['Europe'],Animalia,Chordata,Mammalia,Carnivora,Canidae,Canis,Canis lupus,,,,,,,,,,Omnivore,10,,Bulldog,,,"Friendly, loving and docile!",Mastiff,BrownFawnBlackWhiteTan,Hair,,,,,,,,,,,,"Gentle, calm and affectionate",Should be trained from an early age due to their stubborn nature,,,,,,,,,,,0,1,0
Burmese,['Asia'],Animalia,Chordata,Mammalia,Carnivora,Felidae,Felis,Felis catus,,,,,,,,,,Omnivore,5,,Burmese,,,"Adoring, elegant and affectionate!",Shorthair,BrownBlueBlackCreamLilacGinger,Hair,,13 years on average,6 to 12 lbs.,,,,,,,,,"Intelligent, friendly and affectionate",,,,,,,,,,,,1,0,0
Double Doodle,['North-America'],Animalia,Chordata,Mammalia,Carnivora,Canidae,Canis,Canis lupus,,,,,,,,,,Omnivore,,,,,,,,,,,,,,,,,,,,,,,,,,,,,,,,,0,1,0
English Bulldog,['Europe'],Animalia,Chordata,Mammalia,Carnivora,Canidae,Canis,Canis lupus,,,,,,,,,,Omnivore,,,,,,,,,,,8-10 years,49-55 lbs,,,,,,,,,,,,,,,,,,,,,0,1,0
French Bulldog,['Europe'],Animalia,Chordata,Mammalia,Carnivora,Canidae,Canis,Canis lupus,,,,,,,,,,Omnivore,,,French Bulldog,,," French bulldogs are known to be very sensitive, harboring emotions that they love to express",Mastiff,FawnWhiteTanBrindle,Hair,,10 to 12 years,28 lbs,,,,,,,,,"Affectionate, friendly, attention-demanding",,,,,,,,,,,,0,1,0
Gerbil,"['Africa', 'Asia', 'Eurasia']",Animalia,Chordata,Mammalia,Rodentia,Muridae,,,"Insects, bird nestlings, other gerbils",Pup,Flocks,"Unknown, though some species are endangered","Snakes, birds of prey, carnivores, humans",Their ability to jump. Some gerbils can jump as far as 11.5 feet.,Gerbillines,"Three to four weeks if the female is not nursing, longer if she is.","Deserts and other arid places, though some gerbils are found in pastures, woodlands, scrub forests and mountain valleys.",Omnivore,8,Solitary,"Gerbil, jird, tateril, doop",110.0," Asia, Africa and the Middle East",Originally known as the Desert Rat!,"Colony, horde",BrownGreyRedWhiteOrangePinkOlive,Fur,6.7 mph,Three to four months in the wild to eight years in captivity,0.35 to 8 ounces,"6 to 16 inches long, including the tail",10 to 16 weeks,One month,One to 13 babies,"Owls, vultures, snakes, foxes, other carnivores",Mammal,,,,,,,,,,Seeds,,,,,1,0,0
Gibbon,['Asia'],Animalia,Chordata,Mammalia,Primates,Hylobatidae,Hylobates,Hylobatidae,,,,,,,,,Dense forest and jungle,Omnivore,1,Troop,,,,Found in dense jungles and tropical forests!,,BrownGreyYellowBlackWhite,Hair,35 mph,25-40 years,6-9kg (13.2-19.8lbs),,,,,"Leopards, Snakes, Birds Of Prey",Mammal,,,,,,"Fruit, Eggs, Insects",,,,Fruit,,,,,1,0,0
Ibex,"['Africa', 'Asia', 'Europe', 'North-America', 'South-America']",Animalia,Chordata,Mammalia,Artiodactyla,Bovidae,Capra,,,Kid,Herd,"30,000 for alpine ibex","Poaching, habitat loss","Large, curved horns","Wild goat, steinbock, bouquetin",168 days,Cliffs and mountains,Herbivore,,,Ibex,,"Asia, Europe, Middle East, Africa",,,BrownGrey,Hair,,20 years,91 - 120 kg (200 - 270 lbs),3.9 ft,18 months,4 - 6 months,1 - 3,"Humans, big cats, wolves, eagles",Mammal,0.69 - 1.09 m (27 - 43 inches),,,,,,,,,,,,,,1,0,0
Kerry Blue Terrier,['Europe'],Animalia,Chordata,Mammalia,Carnivora,Canidae,Canis,Canis lupus,,,,,,,,,,Omnivore,,,,,,,,GreyBlueBlackSilver,Hair,,13 – 15 years,40 pounds,,,,,,,,,Smart and loyal,,,,,,,,,,,,0,1,0
Leonberger,['Europe'],Animalia,Chordata,Mammalia,Carnivora,Canidae,Canis,Canis lupus,,puppy,,,,the dog's temperament,,,,Omnivore,6 puppies,,Leonberger,,,,,YellowRedSandy,Hair,16 mph,8-9 years,,,,,,,mammal,,,gentle and calm,,,,,,,,Germany,,,,0,1,0
Nebelung,['North-America'],Animalia,Chordata,Mammalia,Carnivora,Felidae,Felis,Felis Catus,,,,,,,,,,Omnivore,,,,,,,,GreySilver,,,13 to 16 years,seven to 15lbs,,,,,,,,,,,,,,,,,,,,,1,0,0
Pembroke Welsh Corgi,['Europe'],Animalia,Chordata,Mammalia,Carnivora,Canidae,Canis,Canis lupus,,,,,,"Low-set body, large erect ears, and stubby tail",,,,Omnivore,,,,,,,,FawnRedBlackWhiteTan,Hair,,12-15,22-30 lbs,,,,6-8,,,10-12 inches,,"Affectionate, fun-loving, independent, intelligent",,,,,,,,,,,,0,1,0
Pit Bull,['Europe'],Animalia,Chordata,Mammalia,Carnivora,Canidae,Canis,Canis lupus,,,,,,"A stocky, muscular build and a short, smooth coat.",,,,Omnivore,5,,,,,,,BrownGreyFawnRedBlueBlackWhiteTanBlack-Brown,Hair,,,,,,,,,,,,"Stubborn, loyal, friendly, obedient, intelligent",,,,,,,,United Kingdom,,,,0,1,0
Pocket Pitbull,['Europe'],Animalia,Chordata,Mammalia,Carnivora,Canidae,Canis,Canis lupus,,,,,,Flattened face with a bulky neck and large head.,,,,Omnivore,2-9,,,,,,,BrownFawnRedBlueBlackTanBrindleChocolate,,,11-13 years.,11-22 pounds.,,,,,,,12-16 inches.,,,,,,,,,,,,,,0,1,0
Proboscis Monkey,['Asia'],Animalia,Chordata,Mammalia,Primates,Cercopithecidae,Nasalis,Nasalis larvatus,"Leaves, Shoots, Fruits",Infant,Troop,"7,000",Habitat loss,"Long, fleshy nose and swollen stomach",Long-Nosed Monkey,166 days,Coastal mangroves and riverine forests,Omnivore,1,Diurnal,Proboscis Monkey,2.0,Borneo,Natively found on the island of Borneo!,Mammal,BrownGreyRedWhiteTanOrange,Fur,15 mph,15 - 20 years,7kg - 22kg (15lbs - 48lbs),,4 - 5 years,7 months,,"Clouded Leopard, Crocodile, Human",,53cm - 76cm (21in - 30in),,,,,,,,,,,,,,1,0,0
Redbone Coonhound,['North-America'],Animalia,Chordata,Mammalia,Carnivora,Canidae,Canis,Canis lupus,,,,,,,,,,Omnivore,,,,,,,,RedWhite,Hair,,11 – 12 years,70 lbs.,,,,,,,,,"Loyal, friendly, and energetic.",,,,,,,,,,,,0,1,0
Siberpoo,['North-America'],Animalia,Chordata,Mammalia,Carnivora,Canidae,Canis,Canis lupus,,,,,,,,,,Omnivore,,,,,,,,,,,,,,,,,,,,,,,,,,,,,,,,,0,1,0
Springbok,['Africa'],Animalia,Chordata,Mammalia,Artiodactyla,Bovidae,Antidorcas,Antidorcas marsupialis,,Calves,Herd,Up to 2.5 million,Hunting,The large curved horns on the top of the head,,4-6 months,Savannas and deserts,Herbivore,,,Springbok,1.0,Southern Africa,,,BrownBlackWhite,Hair,55 mph,7-9 years on average,27-48kg (59-106lbs),1-1.5m (4-4.5ft),200-400 days,4 months,1-2 calves,"Cheetahs, lions, leopards, hyenas, caracals, jackals, wild dogs, and eagles",Mammal,69-87cm (27-34in),,,,,,,,,"Grasses, leaves, and flowers",,,,,1,0,0
Treeing Tennessee Brindle,['North-America'],Animalia,Chordata,Mammalia,Carnivora,Canidae,Canis,Canis lupus,,puppy,,,,"unique, loud bark",,,,Omnivore,,,,,,,,BlackBrindle,Hair,,10-12 years,,,,,,,mammal,,,Easygoing and energetic,,,,,,,,United States,,,,0,1,0
Wildebeest,['Africa'],Animalia,Chordata,Mammalia,Artiodactyla,Bovidae,Connochaetes,Connochaetes Taurinus,,,,,,,,,Grass plains and bush covered savanna,Herbivore,1,Herd,,,,"Can trek more than 1,000 miles every year!",,BrownBlackTan,Hair,38 mph,15-20 years,120-250kg (265-550lbs),,,,,"Lion, Cheetah, Crocodile",Mammal,,,,,,"Grass, Leaves, Shoots",,,,Grass,,,,,1,0,0
Wood Bison,"['Eurasia', 'North-America']",Animalia,Chordata,Mammalia,Artiodactyla,Bovidae,Bison,Bison bison athabascae,,Calves,Herd,"11,000",Man,"The wood bison has huge shoulders and a sizeable neck, which makes it appear even bigger.",Wood antelope,270 days,Cold steppe,Herbivore,,,"Mountain bison, buffalo",1.0,Canada and Alaska,,,Brown,Hair,34 mph,18-22 years,"544kg-907kg (1,200lb-2000lb",3m(10 ft),24 months,7-13 months,1,,,2 m(9 ft),,,,,,,,,,,,,,1,0,0
Yorkie Bichon,['North-America'],Animalia,Chordata,Mammalia,Carnivora,Canidae,Canis,Canis lupus,,,,,,,,,,Omnivore,,,,,,,,BrownGreyBlackWhiteGoldDark BrownCreamBlonde,Hair,,10 to 12 years,6 to 8 pounds,,,,,,,,,"Fun-loving, friendly, and independent",,,,,,,,,,,,0,1,0
Zebu,"['Africa', 'Asia']",Animalia,Chordata,Mammalia,Artiodactyla,Bovidae,Bos,Bos taurus indicus,,,,,,,,,Tropical jungles and open plains,Herbivore,1,Herd,,,,There are around 75 different species!,,BrownBlackWhite,Leather,25 mph,12-16 years,150-200kg (331-440lbs),,,,,"Human, Bears, Wildcats",Mammal,,,,,,"Grass. Seeds, Flowers",,,,Grass,,,,,1,0,0
Cesky Fousek,['Europe'],Animalia,Chordata,Mammalia,Carnivora,Canidae,Canis,Canis lupus,,,,,,,,,,Omnivore,,,Cesky Fousek,,,An affectionate hunting dog!,Gun Dog,,Hair,,15 years,34kg (75lbs),,,,,,,,,,,,,,,,,,,,,0,1,0
Cesky Terrier,['Europe'],Animalia,Chordata,Mammalia,Carnivora,Canidae,Canis,Canis lupus,,,,,,,,,,Omnivore,,,,,,,,GreyBlueLight-Brown,Hair,,12 – 15 years,24 lbs,,,,,,,,,"Alert, inquisitive, and adventuresome",,,,,,,,,,,,0,1,0
Chinese Crested Dog,['Asia'],Animalia,Chordata,Mammalia,Carnivora,Canidae,Canis,Canis lupus,,,,,,,,,,Omnivore,,,Chinese Crested Dog,,,A hairless breed of dog!,South,,Hair,,13 years,4.5kg (10lbs),,,,,,,,,,,,,,,,,,,,,0,1,0
Chinook,['North-America'],Animalia,Chordata,Mammalia,Carnivora,Canidae,Canis,Canis lupus,,,,,,,,,,Omnivore,,,Chinook,,,A calm and friendly breed!,North,,Hair,,14 years,41kg (90lbs),,,,,,,,,Friendly and loyal,,,,,,,,,,,,0,1,0
Chipmunk,"['Eurasia', 'North-America']",Animalia,Chordata,Mammalia,Rodentia,Sciuridae,,,,,,,,,,,Forest and thick woodland,Omnivore,5,Solitary,,,,There are 25 different species!,,BrownYellowBlackBeige,Fur,21 mph,4 - 8 years,57g - 113g (2oz - 4oz),,,,,"Human, Hawks, Raccoon",Mammal,10cm - 18cm (4in - 7in),Stripes on fur and large front teeth,,,,"Nuts, Fruit, Seeds, Berries",,,,Nuts,,,,,1,0,0
Chipoo,['North-America'],Animalia,Chordata,Mammalia,Carnivora,Canidae,Canis,Canis lupus,,,,,,,,,,Omnivore,,,Chipoo,,,,,BrownGreyFawnBlueBlackWhiteBrindleCreamSilver,Hair,,12-15 years,20lbs,,,,,,,,,"Loyal , outgoing, and intelligent",,,,,,,,,,,,0,1,0
Chiweenie,['North-America'],Animalia,Chordata,Mammalia,Carnivora,Canidae,Canis,Canis lupus,,,,,,,,,,Omnivore,,,,,,,,FawnBlueBlackWhiteTanSilverBlonde,Hair,,12 to 16 years,10 lbs.,,,,,,,,,"Affectionate towards owner, stand-offish towards strangers",,,,,,,,,,,,0,1,0
Chorkie,['North-America'],Animalia,Chordata,Mammalia,Carnivora,Canidae,Canis,Canis lupus,,,,,,,,,,Omnivore,,,,,,,,,,,10 to 15 years,10 lbs,,,,,,,,,loyal and protective,,,,,,,,,,,,0,1,0
Chow Chow,['Asia'],Animalia,Chordata,Mammalia,Carnivora,Canidae,Canis,Canis lupus,,,,,,The adult Cho Chow have a blue tongue,,,,Omnivore,,,Chow Chow,,,Loyal and affectionate to it's family!,North,FawnRedBlueBlackCream,Hair,,9-15 years,32kg (70lbs),,,,,,,,,"Not sociable or outgoing, sometimes aggressive, and often suspicious of strangers",,,,,,,,,,,,0,1,0
Chow Shepherd,['North-America'],Animalia,Chordata,Mammalia,Carnivora,Canidae,Canis,Canis lupus,,,,,,,,,,Omnivore,,,,,,,,BrownGreyFawnRedBlackCream,Hair,,10-12 years,105 lbs,,,,,,,,,"Smart, loyal, and protective",,,,,,,,,,,,0,1,0
Collie,['Europe'],Animalia,Chordata,Mammalia,Carnivora,Canidae,Canis,Canis Lupus,,,,,,,,,,Omnivore,,,Collie,,,Gentle and devoted!,Herd,,Hair,,13 years,34kg (75lbs),,,,,,,,,,,,,,,,,,,,,1,0,0
Corgidor,['North-America'],Animalia,Chordata,Mammalia,Carnivora,Canidae,Canis,Canis lupus,,,,,,,,,,Omnivore,,,,,,,,,,,,,,,,,,,,,,,,,,,,,,,,,0,1,0
Corgipoo,['North-America'],Animalia,Chordata,Mammalia,,,,,,,,,,,,,,Omnivore,,,,,,,,,,,,,,,,,,,,,,,,,,,,,,,,,1,0,0
Corkie,['North-America'],Animalia,Chordata,Mammalia,Carnivora,Canidae,Canis,Canis lupus,,,,,,,,,,Omnivore,,,,,,,,FawnRedBlueMulti-colored,Hair,,11 to 15 years,20 lbs,,,,,,,,,"Friendly, intelligent, and sensitive",,,,,,,,,,,,0,1,0
Cow,"['Africa', 'Asia', 'Central-America', 'Eurasia', 'Europe', 'North-America', 'Oceania', 'South-America']",Animalia,Chordata,Mammalia,Artiodactyla,Bovidae,Bos,Bos Taurus,,,,,,,,,Forest and grassland,Herbivore,1,Herd,,,,There are nearly 1.5 million worldwide!,,BrownBlackWhite,Leather,25 mph,12 - 20 years,"400kg - 800kg (881lbs - 1,760lbs)",1.5m - 1.8m (5ft - 6ft),,,,"Human, Bears, Wolves",Mammal,,Thick leathery skin and complex digestive system,,,,"Grass, Seeds, Flowers",,,,Grass,,,,,1,0,0
Coyote,"['Central-America', 'North-America']",Animalia,Chordata,Mammalia,Carnivora,Canidae,Canis,Canis latrans,,,,,,,,,"Forests, plains and deserts",Carnivore,6,Pack,,,,Also known as the Prairie Wolf!,,BrownGreyTan,Fur,40 mph,10 - 15 years,7kg - 21kg (15lbs - 46lbs),75cm - 90cm (30in - 35in),,,,"Human, Bears, Wolves",Mammal,,"Pointed ears and nose and a long, bushy tail",,,,"Rabbit, Mice, Deer",,,,Rabbit,,,,,1,0,0
Cross Fox,['North-America'],Animalia,Chordata,Mammalia,Carnivora,Canidae,Vulpes,Vulpes vulpes,"Birds, small mammals, insects, spiders, worms, reptiles","Cub, pup, kit",Solitary,Tens of thousands,"Humans, wolves, coyotes, mountain lions, eagles, bears",The cross on its back.,,49 to 55 days,"Forests, prairies, deserts, mountains, cities, suburbs, tundra, scrub, near rivers, farms",Carnivore,,,cross fox,,North America and Canada,,,RedBlackSilver,Fur,31 mph,"10 to 15 years in captivity, seven years in the wild",,"18 to 35 inches with 12 to 22 inch long tails, males a bit larger",10 months,56 to 70 days,5-13 cubs,"Gray wolves, coyotes, eagles, bears, humans and cougars",mammal,14 to 20 inches,,,,,,,,,,,,,,1,0,0
Cuscus,"['Asia', 'Oceania']",Animalia,Chordata,Mammalia,Marsupialia,Phalangeridae,Phalanger,Phalanger maculatus,,,,,,,,,Tropical rainforest and mangroves,Herbivore,2,Solitary,,,,"Has a long, strong prehensile tail!",,BrownGreyBlackWhiteTanCream,Fur,15 mph,8 - 12 years,3kg - 6kg (6.5lbs - 13lbs),15cm - 60cm (6in - 24in),,,,"Snakes, Humans, Large birds of prey",Mammal,,Long tail and strong toes,,,,"Fruit, Leaves, Insects",,,,Fruit,,,,,1,0,0
Douc,['Asia'],Animalia,Chordata,Mammalia,Primates,Cercopithecidae,Pygathrix,,,Infant,Gregarious,"About 26,000 or less. The conservation status of all species of douc is critically endangered.",Humans,"Its colors, especially the colors of the red-shanked douc","Costumed apes, five color douc (for the red-shanked douc), Queen of Primates, douc langur",165 to 205 days,Tropical rainforests and monsoon forests,Herbivore,,,Douc,3.0,Indochina,,"Cartload, troop",GreyRedBlackWhiteOrange,Fur,,24 years,18 to 24 pounds,"21.5 to 24 inches, males larger than females, tail as long as the body",About four years,One year,"One, rarely two","Humans, possibly large birds of prey or big cats",Primate,,,,,,,,,,,,,,,1,0,0
Fennec Fox,"['Africa', 'Asia']",Animalia,Chordata,Mammalia,Carnivora,Canidae,Vulpes,Vulpes zerda,"Berries, Fruit, Rodents, Reptiles",Kit,Sociable,Unknown,Habitat loss and hunting,"Large, over-sized ears",,52 days,Sandy and semi-arid desert,Omnivore,3,Nocturnal,Fennec Fox,1.0,North Africa,Found in the African Sahara Desert!,Mammal,WhiteCreamSandy,Fur,25 mph,10 - 14 years,1kg - 1.5kg (2.2lbs - 3.3lbs),24cm -41cm (9in - 16in),9 months,5 weeks,,,,,,,,,,,,,,,,,,1,0,0
Frenchton,['North-America'],Animalia,Chordata,Mammalia,Carnivora,Canidae,Canis,Canis lupus,,puppy,,,,Ears,"Frenchbo, Fauz Frenchbo, and Froston",,,Omnivore,2-4 puppies,,Frenchton,,,,,BrownRedBlueBlackWhiteBrindleCream,Hair,12 mph,12-15 years,,,,,,,,,,"Pleasant, loyal and energetic",,,,,,,,,,,,0,1,0
Glechon,['North-America'],Animalia,Chordata,Mammalia,Carnivora,Canidae,Canis,Canis lupus,,,,,,,,,,Omnivore,,,,,,,,BrownGreyYellowBlackWhiteMulti-colored,Hair,,12 to 15 years,35 Lbs,,,,,,,,,Brave yet laid back,,,,,,,,,,,,0,1,0
Golden-Crowned Flying Fox,['Asia'],Animalia,Chordata,Mammalia,Chiroptera,Pteropodidae,Acerodon,Acerodon jubatus,,Pup,Group,"10,000 – 20,000",Human hunters,Soft golden cap,,,Caves and forests,Herbivore,,,Golden crowned flying fox,,,,They live in large gatherings in the woods,BlackGold,Hair,,unknown,3.1 pounds,,2 years for females,,One,"Reticulated pythons, eagles, humans",,7 and 11.4 inches,,,,,,,,,"Figs, leaves, some other fruits",,,,,1,0,0
Groundhog (Woodchuck),['North-America'],Animalia,Chordata,Mammalia,Rodentia,Sciuridae,Marmota,Marmota monax,,pups,Social,Over 200 million,"Carnivores, humans","their four long, sharp incisors","Woodchuck, whistlepig",32 days,"Forest, woodlands, suburban gardens",Omnivore,,,"Groundhog, Woodchuck",12.0,United States and Canada,,,BrownGrey,Fur,10 mph,"6 years in the wild, 14 in captivity",10 to 13 pounds,2 feet,2 years,6 weeks,2 to 6,"Coyotes, badgers, bobcats, foxes",rodent, 1 ½ to 2 feet,,,,,,,,,,,,,,1,0,0
Indochinese Tiger,['Asia'],Animalia,Chordata,Mammalia,Carnivora,Felidae,Panthera,Panthera Tigris Corbetti,,,,,,,,,Secluded mountainous forests,Carnivore,2,Solitary,,,,Now thought to be extinct in China!,,BlackWhiteOrange,Fur,60 mph,18 - 25 years,100kg - 195kg (221lbs - 430lbs),,,,,Human,Mammal,,,,,,"Deer, Cattle, Wild Boar",,,,Deer,,,,,1,0,0
Lowchen,['Europe'],Animalia,Chordata,Mammalia,Carnivora,Canidae,Canis,Canis lupus,,,,,,,,,,Omnivore,,,,,,,,BlueBlackTanCreamSilverChocolate,Hair,,12 to 14 years,18 Lbs,,,,,,,,,"Energetic, bold",,,,,,,,,,,,0,1,0
Norwich Terrier,['North-America'],Animalia,Chordata,Mammalia,Carnivora,Canidae,Canis,Canis lupus,,,,,,,,,,Omnivore,,,,,,,,,,,,,,,,,,,,,,,,,,,,,,,,,0,1,0
Ocelot,"['Central-America', 'South-America']",Animalia,Chordata,Mammalia,Carnivora,Felidae,Leopardus,Leopardus pardalis,"Rodents, Lizards, Deer",Kitten,Solitary,"800,000",Habitat loss,"Rosettes, spots and stripes on fur",Painted Leopard,79 - 85 days,"Tropical jungle, grassland and marshes",Carnivore,2,Nocturnal/Crepuscular,Ocelot,1.0,South America,Also known as the Painted Leopard!,Mammal,GreyYellowRedBlackTan,Fur,38 mph,8 - 12 years,11.5kg - 16kg (25lbs - 35lbs),55cm - 100cm (22in - 40in),2 - 3 years,6 weeks,,"Jaguar, Puma, Harpy Eagle",,,,,,,,,,,,,,,,1,0,0
Pomchi,['North-America'],Animalia,Chordata,Mammalia,Carnivora,Canidae,Canis,Canis lupus,,,,,,,,,,Omnivore,,,,,,,,BlueOrangeChocolateGrey-BrownBlonde,Hair,,13 to 18 years,,,,,,,,11 lbs.,,"Sassy, outgoing, and loyal",,,,,,,,,,,,0,1,0
Poochon,['Oceania'],Animalia,Chordata,Mammalia,Carnivora,Canidae,Canis,Canis lupus,,,,,,,,,,Omnivore,,,,,,,,GreyBlackTanCream,Hair,,12 to 15 years,6 to 17 pounds,,,,,,,,,,,,,,,,,,,,,0,1,0
Porcupine,"['Asia', 'Central-America', 'Eurasia', 'Europe', 'North-America', 'South-America']",Animalia,Chordata,Mammalia,Rodentia,Erethizontidae,Erethizon,Erethizon Dorsaum,,,,,,,,,Dense forests and grassland,Omnivore,1,Solitary,,,,There are 30 different species worldwide!,,BrownGreyYellowBlack,Spikes,2 mph,8-12 years,5.4-16kg (12-35lbs),,,,,"Owl, Eagles, Wolves",Mammal,,,,,,"Roots, Leaves, Berries",,,,Roots,,,,,1,0,0
Rhinoceros,"['Africa', 'Asia']",Animalia,Chordata,Mammalia,Perissodactyla,Rhinocerotidae,,Rhinocerotidae,,,,,,,,,"Tropical bushland, grassland and savannas",Herbivore,1,Solitary,,,,It's horns are made from keratin!,,BrownGreyBlack,Leather,30 mph,35-50 years,"800-3,500kg (1,765-7,716lbs)",,,,,"Human, Wild cats",Mammal,,,,,,"Grass, Fruit, Berries, Leaves",,,,Grass,,,,,1,0,0
Schipperke,['Europe'],Animalia,Chordata,Mammalia,Carnivora,Canidae,Canis,Canis lupus,,,,,,,,,,Omnivore,,,,,,,,FawnBlueBlackTanCreamChocolate,Hair,,12 to 14 years,16 lbs,,,,,,,,,Confident and lively,,,,,,,,,,,,0,1,0
Scottish Terrier,['Europe'],Animalia,Chordata,Mammalia,Carnivora,Canidae,Canis,Canis lupus,,,,,,,,,,Omnivore,,,,,,,,BlackBrindleBeige,Hair,,12-15 years,22 lbs,,,,,,,,,"Confident, independent, and alert",,,,,,,,,,,,0,1,0
Welsh Corgi,['Europe'],Animalia,Chordata,Mammalia,Carnivora,Canidae,Canis,Canis lupus,,,,,,,,,,Omnivore,,,Welsh Corgi,,,There are two distinct breeds!,Herd,,Hair,,13 years,14kg (30lbs),,,,,,,,,,,,,,,,,,,,,0,1,0
