Rabbit,"['Africa', 'Asia', 'Eurasia', 'Europe', 'North-America']",Animalia,Chordata,Mammalia,Lagomorpha,Leporidae,Oryctolagus,Oryctolagus cuniculus,,,,,,,,,"Forest thickets, meadows and woodland",Herbivore,6,Group,,,,There are more than 50 different species!,,BrownGreyBlackWhiteTan,Fur,2.4 mph,4-9 years,0.5-3kg (1.1-6.6lbs),,,,,"Foxes, wolves, bobcats, eagles, owls, coyotes",Mammal,,,,,,"Clover, Grass, Crunchy vegetables",,,,Clover,,,,,1,0,0
Raccoon,"['Central-America', 'Europe', 'North-America', 'South-America']",Animalia,Chordata,Mammalia,Carnivora,Procyonidae,Procyon,Procyon lotor,,,,,,,,,Woodland areas close to water,Omnivore,5,Solitary,,,,Known to wash their food before eating it!,,BrownGreyBlackWhite,Fur,15 mph,12-16 years,3.5-9kg (7.7-19.8lbs),,,,,"Bobcat, Foxes, Wolves, Mountain Lions",Mammal,,,,,,"Fish, Nuts, Berries, Corn",,,,Fish,,,,,0,0,1
Raccoon Dog,"['Asia', 'Eurasia', 'Europe']",Animalia,Chordata,Mammalia,Carnivora,Canidae,Nyctereutes,Nyctereutes procyonoides,,,,,,,,,Thick forests close to water,Carnivore,8,Pack,,,,The only hibernating canine!,,BrownYellowBlackTan,Fur,25 mph,3 - 8 years,3kg - 10kg (6.6lbs - 22lbs),50cm - 65cm (19.6in - 26in),,,,"Foxes, Wolves, Wildcats",Mammal,,Dexterous front paws and pointed snout,,,,"Frogs, Fish, Rodents",,,,Frogs,,,,,0,0,1
Ragamuffin,['North-America'],Animalia,Chordata,Mammalia,Carnivora,Felidae,Felis,Felis catus,,,,,,"Loveable purrsonalities – Ragamuffins are docile, friendly and have a sweet temperament.",,,,Omnivore,,,,,,,,BrownBlueWhiteDark Brown,Hair,,18 years,20lbs,,,,,,,,,,,,,,,,,,,,,1,0,0
Ragdoll,['North-America'],Animalia,Chordata,Mammalia,Carnivora,Felidae,Felis,Felis catus,,,,,,,Floppy cat,,,Omnivore,4,,Ragdoll,,,One of the larger breeds of domestic cat!,Mediumhair,BrownFawnBlueBlackWhiteCreamChocolateLilacGolden,Hair,,about 15 years,15-to-20 pounds,,,,,,,,,"Affectionate, calm and friendly",,,,,,,,,,,,1,0,0
Raggle,['North-America'],Animalia,Chordata,Mammalia,Carnivora,Canidae,Canis,Canis lupus,,,,,,,,,,Omnivore,,,,,,,,BrownBlackWhiteCream,Hair,,12 to 15 years,20 lbs,,,,,,,,,Strong-willed and energetic,,,,,,,,,,,,0,1,0
Rat,"['Africa', 'Antarctica', 'Asia', 'Central-America', 'Eurasia', 'Europe', 'North-America', 'Oceania', 'South-America']",Animalia,Chordata,Mammalia,Rodentia,Muridae,Rattus,Rattus rattus,,,,,,,,,Underground close to human settlements,Omnivore,8,Solitary,,,,Omnivores that eat anything!,,BrownGreyBlackWhite,Fur,8 mph,2-5 years,200-900g (0.4-2lbs),,,,,"Owls, Snakes, Raccoon, Cats",Mammal,,,,,,"Eggs, Nuts, Potatoes, Corn",,,,Eggs,,,,,0,0,1
Rat Terrier,['North-America'],Animalia,Chordata,Mammalia,Carnivora,Canidae,Canis,Canis lupus,,,,,,,,,,Omnivore,,,Rat Terrier,,,,,FawnBlueBlackWhiteChocolate,Hair,,15 - 18 years,35 lbs,,,,,,Terrier,,,Perceptive and stubborn,,,,,,,,,,,,0,1,0
Red Panda,['Asia'],Animalia,Chordata,Mammalia,Carnivora,Ailuridae,Ailurus,Ailurus fulgens,"Bamboo, Berries, Eggs",Cub,Solitary,"less than 3,000",Habitat loss,Rusty coloured thick fur and striped face,"Lesser Panda, Fire Fox",4 months,High-altitude mountain forest,Omnivore,3,Nocturnal,Red Panda,1.0,Himalayas,"There are less than 3,000 left in the wild!",Mammal,BrownRedWhite,Fur,24 mph,8 - 12 years,3kg - 6.2kg (7lbs - 14lbs),60cm - 120cm (24in - 47in),18 months,5 months,,"Snow Leopard, Marten, Human",,,,,,,,,,,,,,,,1,0,0
Red-handed Tamarin,['South-America'],Animalia,Chordata,Mammalia,Primates,Callitrichidae,Saguinus,Saguinus midas,,,,,,,,,Lowland tropical forest,Omnivore,2,Troop,,,,Red hair on hands on feet!,,BrownRedBlackGoldTan,Fur,24 mph,8 - 15 years,220g - 900g (7.7oz - 32oz),18cm - 30cm (7in - 12in),,,,"Hawks, Snakes, Wild Cats",Mammal,,"Small body size and long, thin tail",,,,"Fruit, Insects, Rodents",,,,Fruit,,,,,1,0,0
Rock Hyrax,"['Africa', 'Asia']",Animalia,Chordata,Mammalia,Hyracoidea,Procaviidae,Procavia,Procavia capensis,"Grasses, Fruits, Lizards",Pup,Colony,Sustainable,Habitat loss,Rubbery soles of their feet,"Rock Dassie, Rock Rabbit",8 months,Dry savanna and rainforest,Omnivore,2,Diurnal,Rock Hyrax,2.0,eastern to southern Africa,Actually related to Elephants and Manatees!,Mammal,BrownGreyYellowWhiteTan,Fur,18 mph,5 - 12 years,3kg - 4kg (6.6lbs - 8.8lbs),45cm - 55cm (17.7in - 21.6in),16 - 17 months,4 months,,"Leopards, Large Birds, Snakes",,,,,,,,,,,,,,,,1,0,0
Russian Bear Dog,['Eurasia'],Animalia,Chordata,Mammalia,Carnivora,Canidae,Canis,Canis lupus,,,,,,,,,,Omnivore,,,,,,,,BrownGreyBlackCream,Hair,,10 to 12 years,170 pounds,,,,,,,23 to 30 inches,,Bold and Fearless,,,,,,,,,,,,0,1,0
Russian Blue,['Eurasia'],Animalia,Chordata,Mammalia,Carnivora,Felidae,Felis,Felis catus,,,,,,,"Archangel Cat, Archangel Blue",,,Omnivore,6,,Russian Blue,,,First brought to the UK in the 1800s!,Shorthair,SilverLight GreyDark Grey,Hair,,15-20 years,"males 10-12 pounds, females 7-10 pounds",,,,,,,,,"Independent, easy-going and loyal",,,,,,,,,,,,1,0,0
Saanen Goat,['Europe'],Animalia,Chordata,Mammalia,Artiodactyla,Bovidae,Capra,Capra aegagrus hircus,grass and legume,kid or billy,,"900,000",,white skin and short white coat,"Saanenziege, Chèvre de Gessenay, and Capra di Saanen",,cool weather and hilly terrain,Omnivore,2,HerdFlock,saanen goat,8.0,,,herd,WhiteCream,Hair,,about 10 years,,,9 months,12 months,,"Coyotes, bobcats, wild dogs, and wolves",mammal,30 inches,,calm,,,,,,,,Switzerland,,,,1,0,0
Saarloos Wolfdog,['Europe'],Animalia,Chordata,Mammalia,Carnivora,Canidae,Canis,Canis lupus,,,,,,,,,,Omnivore,,,,,,,,,Hair,,,,,,,,,,,,,,,,,,,,,,,,0,1,0
Saber-Toothed Tiger,"['Central-America', 'North-America', 'South-America']",Animalia,Chordata,Mammalia,Carnivora,Felidae,Smilodon,Smilodon populator,,,,,,,,,Forests and grasslands,Carnivore,3,Pack,,,,Canines up to 7 inches long!,,BrownYellowBlackWhiteTan,Fur,,20 - 40 years,300kg (661lbs),2m - 2.5m (79in - 98in),,,,Humans,Mammal,,Large muscular body and long canine teeth,,,,"Deer, Bison, Woolly Mammoth",,,,Deer,,,,,1,0,0
Sable,"['Asia', 'Eurasia']",Animalia,Chordata,Mammalia,Carnivora,Mustelidae,Martes,Martes zibellina,"Molluscs, hares, rodents, musk deer",Cub,Solitary,2.3 million,Poaching,Luxurious fur,,245 to 298 days,Dense forest,Omnivore,,,Sable,,"Russia, Mongolia, parts of China and Korean Peninsula",,Solitary,BrownBlack,Fur,,18 to 22 years,2 to 4 pounds,35 to 36 centimeters,2 years,7 weeks,1 to 7,"Wolves, foxes, wolverines, tigers, lynxes, eagles, owls",Mammal,,,,,,,,,,,,,,,1,0,0
Sable Black German Shepherd,['Europe'],Animalia,Chordata,Mammalia,Carnivora,Canidae,Canis,Canis lupus,,Puppy,,,,,,,,Omnivore,,,,,,,,GreyRedBlackTanSilver,Hair,30 mph,9-13 years,,,,,5-9 puppies,,mammal,,,"Intelligent, loyal, and courageous",,,,,,,,Germany,,,,0,1,0
Sable Ferret,"['Africa', 'Asia', 'Central-America', 'Eurasia', 'Europe', 'North-America', 'Oceania', 'South-America']",Animalia,Chordata,Mammalia,Carnivora,Mustelidae,Mustela,Mustela furo,Rabbits and vermin if it is used for ferreting,Kit,Gregarious,Millions. The conservation status is “domesticated.”,None,"Its beautiful, dark brown fur",Poley,42 days,"Among humans, though native habitats are forests and woods near water.",Carnivore,,,Sable Ferret,1.0,Cosmopolitan,,A business or busyness,BrownWhiteGoldCream,Fur,15 mph,Six to 10 years,0.66 to 5.95 pounds,"20 inches including the tail, males larger than females",6 months,Three to six weeks,As many as 15 kits,None,Mammal,,,,,,,,,,Meat in the form of ferret food,,,,,1,0,0
Saiga,['Asia'],Animalia,Chordata,Mammalia,Artiodactyla,Bovidae,Saiga,Saiga tatarica,,calves,Herd,"50,000-150,000",poaching,Large nose with downward-facing nostrils,,5 months,"arid grasslands, steppes",Herbivore,,Herd,Saiga,2.0,Central Asia,,,BrownGreyYellow,Hair,80 mph,10-12yrs,30-45kg (66-99lbs),1-1.5m (3.2-5ft),8 months to 2 years,4 months,1-2,"wolves, dogs, foxes, humans",Antelope,0.6-0.8m (2-2.5 ft),,,,,,,,,"grasses, lichen",,,,,1,0,0
Saint Bernard,['Europe'],Animalia,Chordata,Mammalia,Carnivora,Canidae,Canis,Canis lupus,,,,,,,,,,Omnivore,,,Saint Bernard,,,"Gentle, loyal and friendly!",Mastiff,BrownYellowRedWhiteBrindleWhite-BrownMulti-colored,Hair,,10 years,91kg (200lbs),,,,,,,,,"Intelligent, friendly, loyal",,,,,,,,,,,,0,1,0
Saint Shepherd,['North-America'],Animalia,Chordata,Mammalia,Carnivora,Canidae,Canis,Canis lupus,,,,,,,,,,Omnivore,,,,,,,,BrownBlackWhite,Hair,,10 to 14 years,150 lbs,,,,,,,,,"Friendly, intelligent, eager-to-please",,,,,,,,,,,,0,1,0
Saluki,"['Asia', 'Europe']",Animalia,Chordata,Mammalia,Carnivora,Canidae,Canis,Canis lupus,,Puppy,,,,,,,,Omnivore,,,,,,,,FawnRedWhiteGoldTanCream,Hair,43 mph,10-17 years,,,,,4-8 puppies,,,,,,,,,,,,,Fertile Crescent,,,,0,1,0
Sambar,"['Asia', 'North-America', 'Oceania']",Animalia,Chordata,Mammalia,Artiodactyla,Cervidae,Rusa,Rusa unicolor,,Fawn,Solitary/Group,Unknown,Habitat loss and hunting,The large antlers of the male,Sambhur or sambur,8-9 months,Forests and grasslands,Herbivore,,,Sambar,1.0,South Asia,,,BrownWhite,Fur,,26 years,"109-544kg (240-1,200lbs)",1.5-2.4m (5-8ft),2 years,,1-2 fawns,"Humans, tigers, leopards, and dholes",Mammal,1.2-1.5m (4-5ft),,,,,,,,,"Leaves, berries, grasses, bark, fruits, herbs, and buds",,,,,1,0,0
Samoyed,['Not Listed'],Animalia,Chordata,Mammalia,Carnivora,Canidae,Canis,Canis lupus,,,,,,,,,,Omnivore,,,Samoyed,,,,,WhiteCreamBeige,Hair,,12 to 14 years,,,,,,,,,,"Gentle, friendly, adaptable",,,,,,,,,,,,0,1,0
Saola,['Asia'],Animalia,Chordata,Mammalia,Artiodactyla,Bovidae,Pseudoryx,Pseudoryx nghetinhensis,"Leaves, Grasses, Herbs",Calf,Mainly solitary,less than 250,Habitat loss and hunting,Horns that can grow up to 50cm long,Asian Unicorn,8 months,Moist and dense evergreen forest,Herbivore,1,Diurnal,Saola,1.0,Mountains of Vietnam-Laos border,Only known to science since 1992!,Mammal,BrownRedBlack,Fur,23 mph,8 - 12 years,80kg - 100kg (176lbs - 220lbs),150cm - 200cm (59in - 77in),2 - 3 years,6 - 8 months,,"Human, Tiger, Crocodile",,,,,,,,,,,,,,,,1,0,0
Savanna Goat,"['Africa', 'North-America', 'Oceania', 'South-America']",Animalia,Chordata,Mammalia,artiodactyla,Bovidae,Capra,Capra hircus,,Kid,Flock,"3,000 in the U.S., South Africa unknown",,Solid white coat with black skin,,150 days,savanna mixed woodland-grassland,Herbivore,,,savanna goat,-1.0,"South Africa, South America, United States, New Zealand, Australia",,,BlackWhite,Hair,,15-18 years,132 pounds,,4-6 months,10 to 12 weeks,1-3 kids,"humans, foxes, wolves, coyotes, mountain lions, bobcats, bears, eagles, dogs",Mammal,1.64ft - 2.08ft,,,,,,,,,,,,,,1,0,0
Schneagle,['North-America'],Animalia,Chordata,Mammalia,Carnivora,Canidae,Canis,Canis lupus,,,,,,,,,,Omnivore,,,,,,,,BlackWhiteTan,Hair,,12-15 years,25 lbs,,,,,,,,,"Alert and energetic, but devoted",,,,,,,,,,,,0,1,0
Scimitar-horned Oryx,['Africa'],Animalia,Chordata,Mammalia,Artiodactlya,Bovidae,Oryx,Oryx Dammah,,,,,"Human hunting, loss of habitat",,,,Desert and savanna woodlands,Herbivore,,Diurnalnomadic,Scimitar-horned oryx,,Norther Africa,Believed to be the inspiration for unicorn myths!,Mammal,,,MPH mph,15-20 years,200 to 460 lbs,,,,,"Lions, leopards, golden jackals, hyenas",,,,,,,,,,,,,,,,1,0,0
Sea Lion,['Ocean'],Animalia,Chordata,Mammalia,Carnivora,Otariidae,,Otariidae,,,,,,,,,Coastal waters and rocky shorelines,Omnivore,1,Herd,,,,It's flippers allow it to walk on the land,,BrownGreyTan,Fur,27 mph,15-22 years,"300-1,000kg (660-2,200lbs)",,,,,"Human, Sharks, Killer Whale",Mammal,,,,,,"Fish, Crabs, Squid",,,,Fish,,,,,1,0,0
Sea Otter,['Ocean'],Animalia,Chordata,Mammalia,Carnivora,Mustelidae,Enhydra,Enhydra Lutris,,,,,,,,,Unpolluted areas close to the shore,Omnivore,1,Solitary,,,,Eats over 40 different marine species!,,BrownBlackTan,Fur,7 mph,12-15 years,14-45kg (30-100lbs),,,,,"Sharks, Humans, Killer Whales",Mammal,,,,,,"Sea Urchins, Clams, Crabs, Seaweed",,,,Sea Urchins,,,,,1,0,0
Seal,['Ocean'],Animalia,Chordata,Mammalia,Carnivora,Pinnipedia,,Phoca vitulina,,,,,,,,,Coastal waters and rocky shores,Carnivore,1,Herd,,,,There are 30 different species worldwide!,,BrownBlackWhiteTan,Smooth,27 mph,15-25 years,"105-3,000kg (230-6,000lbs)",,,,,"Human, Sharks, Killer Whale",Mammal,,,,,,"Fish, Crabs, Squid",,,,Fish,,,,,1,0,0
Sealyham Terrier,['Europe'],Animalia,Chordata,Mammalia,Carnivora,Canidae,Canis,Canis lupus,,,,,,,,,,Omnivore,,,,,,,,BlueWhiteChocolate,Hair,,12 – 14 years,,,,,,,,24 lbs,,Variable between quiet and frisky,,,,,,,,,,,,0,1,0
Sei Whale,['Ocean'],Animalia,Chordata,Mammalia,Cetacea,Balaenopteridae,Balaenoptera,Balaenoptera borealis," Krill and other euphausiids, copepods, small fish and squid",,Solitary,"80,000","Humans, climate change, pollution","Its tall, sickle-shaped dorsal fin","Japan finner, lesser fin whale, pollock whale, sardine whale, coalfish, Rudolph’s rorqual",10.5 to 12 months,,Carnivore,,,Sei Whale,2.0,,,,GreyWhite,Skin,32 mph,70 years plus, Up to 31 tons,"64 feet, females bigger",,,,Humans,Mammal,,,,,,,Salt,,,,,,,,0,1,0
Serval,['Africa'],Animalia,Chordata,Mammalia,Carnivora,Felidae,Leptailurus,Leptailurus serval,"Rodents, Birds, Frogs",Kitten,Solitary,Stable,Habitat loss and hunting,Large and round dish-like ears,African Serval,72 days,Wetlands and grasslands close to water,Carnivore,2,Crepuscular,Serval,10.0,Sub-Saharan Africa,Can leap more than 1 meter into the air!,Mammal,BrownYellowBlackWhiteOrange,Fur,40 mph,10 - 20 years,3.5kg - 19kg (7.7lbs - 41.9lbs),60cm - 100cm (23.6in - 39.4in),18 - 24 months,5 months,,"Human, Leopard, Hyena",,,,,,,,,,,,,,,,1,0,0
Shepadoodle,['North-America'],Animalia,Chordata,Mammalia,Carnivora,Canidae,Canis,Canis lupus,,,,,,,,,,Omnivore,,,,,,,,BrownBlackWhite,Hair,,11-14 years,90 lbs,,,,,,,,,,,,,,,,,,,,,0,1,0
Shepkita,['North-America'],Animalia,Chordata,Mammalia,Carnivora,Canidae,Canis,Canis lupus,,,,,,,,,,Omnivore,,,,,,,,BrownBlackWhiteGoldTan,Hair,,10-13 years,110 lbs,,,,,,,,,"Active, loyal, eager to please",,,,,,,,,,,,0,1,0
Shiba Inu,['Asia'],Animalia,Chordata,Mammalia,Carnivora,Canidae,Canis,Canis lupus,,,,,,,,,,Omnivore,,,,,,,,,Hair,,,,,,,,,,,,,,,,,,,,,,,,0,1,0
Siamese,['Asia'],Animalia,Chordata,Mammalia,Carnivora,Felidae,Felis,Felis catus,,,,,,,Meezer,,,Omnivore,4,,Siamese,,,Originated from temple cats in Thailand!,Shorthair,BrownGreyBlueBlackWhiteCreamLilac,Hair,,12-20 years,Six to 12 pounds,,,,,,,,,"Intelligent, calm and sociable",,,,,,,,,,,,1,0,0
Siberian,['Eurasia'],Animalia,Chordata,Mammalia,Carnivora,Felidae,Felis,Felis catus,,,,,,,Siberian Forest Cat,,,Omnivore,5,,Siberian Cat,,,An exceptionally agile jumper!,Longhair,BrownFawnBlueBlackWhiteCreamLilacGolden,Hair,,11 to 15 years,8 to 17 lbs.,,,,,,,,,"Affectionate, loving and loyal",,,,,,,,,,,,1,0,0
Siberian Husky,['North-America'],Animalia,Chordata,Mammalia,Carnivora,Canidae,Canis,Canis lupus,,,,,,,,,,Omnivore,,,Siberian Husky,,,Is adequately warm in sub-zero temperatures!,North,,Hair,,14 years,27kg (60lbs),,,,,,,,,,,,,,,,,,,,,0,1,0
Siberian Ibex,"['Asia', 'Eurasia']",Animalia,Chordata,Mammalia,Cetartiodactyla,Bovidae,Capra,Capra sibirica,,Kid,Gregarious,"Around 256,573 individuals in the wild, but its conservation status is near threatened.","Humans, snow leopards, habitat destruction","The male’s huge, curved, ridged horns","Gobi ibex, Mongolian ibex, Himalayan ibex, Central Asian ibex, Altai ibex, Tian Shan ibex",About 6 months,"Mountains, rocky, semi-arid places, alpine meadows",Herbivore,,,Siberian Ibex,1.0,Central Asia,,Herd,BrownGreyBlack,Hair,43.5 mph,"15 to 17 years, 22 in captivity",66 to 220 pounds,51 to 65 inches,"Two years for females, as long as five years for males",Five to eight months,1,"Humans, snow leopards, golden eagles, wild dogs, wolves, wolverines",Mammal,26 to 43 inches at the shoulder,,,,,,,,,,,,,,1,0,0
Siberian Retriever,['North-America'],Animalia,Chordata,Mammalia,Carnivora,Canidae,Canis,Canis lupus,,,,,,,,,,Omnivore,,,,,,,,BlackWhiteGoldTanChocolate,Hair,,,65 lbs,,,,,,,,,Intelligent and affectionate but can be stubborn,,,,,,,,,,,,0,1,0
Siberian Tiger,"['Asia', 'Eurasia']",Animalia,Chordata,Mammalia,Carnivora,Felidae,Panthera,Panthera Tigris Altaica,,,,,,,,,Dense tropical forest,Carnivore,3,Solitary,,,,Also known as the Amur tiger!,,BlackWhiteOrange,Fur,60 mph,18 - 25 years,100kg - 350kg (220lbs - 770lbs),,,,,Human,Mammal,,,,,,"Deer, Cattle, Wild Boar",,,,Deer,,,,,1,0,0
Silver Labrador,['North-America'],Animalia,Chordata,Mammalia,Carnivora,Canidae,Canis,Canis lupus,,,,,,,,,,Omnivore,,,,,,,,GreySilver,Hair,,10 - 14 years,80 lbs,,,,,,,,,"Intelligent, loyal, and outgoing",,,,,,,,,,,,0,1,0
Snow Leopard,"['Asia', 'Eurasia']",Animalia,Chordata,Mammalia,Carnivora,Felidae,Panthera,Panthera uncia,"sheep, deer, antelopes, yaks and gazelles and smaller mammals and birds",cub,Solitary,8478,"Poaching, climate change",Pale gray coat and gray spots,Ounce,90 to 105 days,Mountains,Carnivore,,,Snow leopard,4.0,Central Asia,,Solitary,GreyWhite,Fur,,21 years,,,2-3 years,5 months,2 to 7,"Leopards, occasionally and other snow leopards",Mammal,,,,,,,,,,,,,,,1,0,0
Snowshoe Hare,['North-America'],Animalia,Chordata,Mammalia,Lagomorpha,Leporidae,Lepus,Lepus americanus," Leafy plants, flowers, grass, bark",Leveret,Solitary,, Habitat loss, Large hind feet,,36-40 days,"Forests, open fields, riverside thickets",Herbivore,,,Snowshoe hare,,Northern United States and Canada,,Solitary,,,,,,,,,1-7,"Coyotes, bobcats, wolves, owls, red foxes, lynx", Mammal,,,,,,,,,,,,,,,1,0,0
Somali,['North-America'],Animalia,Chordata,Mammalia,Carnivora,Felidae,Felis,Felis catus,,,,,,,"Fox Cat, Longhaired Abyssinian",,,Omnivore,5,,Somali cat,,,"Active, intelligent and playful!",Longhair,BrownFawnBlackWhiteCreamGingerGolden,Hair,,9-16 years,6-13lbs,,,,,,,,,"Active, curious and playful",,,,,,,,,,,,1,0,0
South China Tiger,['Asia'],Animalia,Chordata,Mammalia,Carnivora,Felidae,Panthera,Panthera Tigris Amoyensis,,,,,,,,,Dense tropical forest,Carnivore,3,Solitary,,,,There are less than 20 in the wild!,,BlackWhiteOrange,Fur,60 mph,18 - 25 years,100kg - 195kg (221lbs - 430lbs),,,,,Human,Mammal,,,,,,"Deer, Cattle, Wild Boar",,,,Deer,,,,,1,0,0
Spanador,['North-America'],Animalia,Chordata,Mammalia,Carnivora,Canidae,Canis,Canis lupus,,,,,,,,,,Omnivore,,,,,,,,,,,,,,,,,,,,,,,,,,,,,,,,,0,1,0
Spanish Goat,"['Central-America', 'Europe', 'North-America']",Animalia,Chordata,Mammalia,Artiodactyla,Calvo,Capra,Capra aegagrus hircus,"Grass, herbs, shrubs, weeds, tree barks, and leaves",Calf,Herd,"approximately 500,000","Domesticated dogs, wolves, foxes, and coyotes",Long horizontal ears and thorns that are twisted at the points.,Brush goats and scrub goats,About 155 days,"Spain, Mexico, and the USA",Herbivore,,,,,,,,BrownGreyFawn,,,6-7 years,male: 200 to 250 lbs. females: 11 to 150 lbs.,20 inches,5 months to 1 year,,2-4,"Domesticated dogs, wolves, foxes, and coyotes",,20 inches,,,,,,,,,,,,,,1,0,0
Spanish Mastiff,['Europe'],Animalia,Chordata,Mammalia,Carnivora,Canidae,Canis,Canis lupus,,,,,,,,,,Omnivore,,,,,,,,YellowFawnRedBlackBrindle,Hair,,10 to 12 years,220 lbs.,,,,,,,,,"Affectionate, laid-back, independent",,,,,,,,,,,,0,1,0
Spectacled Bear,['South-America'],Animalia,Chordata,Mammalia,Carnivora,Ursidae,Tremarctos,Tremarctos Ornatus,,,,,,,,,Coastal forests and deserts,Omnivore,2,Solitary,,,,Native to the Andes mountains of South America!,,GreyBlackWhite,Fur,30 mph,20 - 30 years,130kg - 200kg (286lbs - 440lbs),,,,,"Human, Jaguar, Mountain lion",Mammal,1.5m - 2m (4.9ft - 6.6ft),Light spectacles on face and long claws,,,,"Berries, Mice, Birds",,,,Berries,,,,,1,0,0
Sperm Whale,['Ocean'],Animalia,Chordata,Mammalia,Cetacea,Physeteridae,Physeter,Physeter macrocephalus,"Squid, sharks, skates, fish",,Pod/Solitary,"300,000 to 450,000","Human activity, climate change",Size and huge head,Cachalot,14 to 16 months,Ocean,Carnivore,1,,Sperm Whale,4.0,,Each tooth weighs 1kg!,,GreyWhite,Smooth,23 mph,Up to 60 years,35 to 45 tons,49 to 59 feet,,,,"Sharks, Humans, Killer Whales",Cetacean Common nam,,Cone-shaped teeth and enormous body size,,,,,Salt,,,Squid,,,6 - 9,,0,1,0
Spinone Italiano,['Europe'],Animalia,Chordata,Mammalia,Carnivora,Canidae,Canis,Canis lupus,,,,,,,,,,Omnivore,,,,,,,,BrownWhiteOrange,Hair,,12 – 14 years,81 lbs,,,,,,,,,"Good-natured, hard-working, and playful",,,,,,,,,,,,0,1,0
Springador,['North-America'],Animalia,Chordata,Mammalia,Carnivora,Canidae,Canis,Canis lupus,,,,,,,,,,Omnivore,,,,,,,,,,,,,,,,,,,,,,,,,,,,,,,,,0,1,0
Sri Lankan Elephant,['Asia'],Animalia,Chordata,Mammalia,Proboscidea,Elephantidae,Elephas,Elephas Maximus Maximus,,,,,,,,,Rainforest and tropical woodland,Herbivore,1,Herd,,,,Now restricted to a few parks!,,BrownGreyBlack,Leather,27 mph,55 - 70 years,"3,000kg - 5,000kg (6,500lbs - 11,000lbs)",,,,,"Human, Tiger",Mammal,2m - 3m (7ft - 10ft),Long trunk and large feet,,,,"Grass, Fruit, Roots",,,,Grass,,,,,1,0,0
Stabyhoun,['Europe'],Animalia,Chordata,Mammalia,Carnivora,Canidae,Canis,Canis lupus,,,,,,,"Stabij, Stabijhoun, Fryske Stabij, Beike, Dutch Stabyhoun, Stabij, Frisian Pointer",,,Omnivore,,,Stabyhoun,,,,,BlackWhiteOrangeChocolate,Hair,,12 to 15 years,55lbs,,,,,,,,,"Gentle, sensitive, and active",,,,,,,,,,,,0,1,0
Staffordshire Bull Terrier,['Europe'],Animalia,Chordata,Mammalia,Carnivora,Canidae,Canis,Canis Lupus,,,,,,,,,,Omnivore,,,Staffordshire Bull Terrier,,,Known for their loyalty to their family!,Mastiff,,Hair,,14 years,17kg (38lbs),,,,,,,,,,,,,,,,,,,,,1,0,0
Standard Schnauzer,['Europe'],Animalia,Chordata,Mammalia,Carnivora,Canidae,Canis,Canis lupus,,,,,,,,,,Omnivore,,,,,,,,BlackWhite,Hair,,13-16,30-50,,,,4-8 pups,,,18-20,bristly eyebrows and a long mustache,"Intelligent, playful, affectionate, loyal",,,,,,,,,,,,0,1,0
Star-nosed mole,['North-America'],Animalia,Chordata,Mammalia,Eulipotyphla,Talpidae,Condylura,Condylura cristata,"Worms, mollusks, fish, and insects",Pups,Colony,Unknown,Habitat loss,The star-shaped sensory organ on the nose,,45 days,Marshes and wetlands,Carnivore,,,Star-Nosed Mole,1.0,United States and Canada,,,BrownBlackPink,Hair,4 mph,3-4 years on average,55g (2oz),15-20cm (6-8in),10 months,1 month,2-7 pups,"Foxes, weasels, minks, domesticated cats and dogs, skunks, owls, and hawks",Mammal,,,,,,,,,,,,,,,1,0,0
Steller’s Sea Cow,['Ocean'],Animalia,Chordata,Mammalia,Sirenia,Dugongidae,Hydrodamalis,Hydrodamalis Gigas,,,,,,,,,Arctic Tundra,Herbivore,1,Herd,,,,Hunted to extinction in 17 years!,,BrownGreyBlack,Smooth,,50 - 80 years,8000kg (8.8tons),8m - 9m (26ft - 30ft),,,,Large sharks and humans,Mammal,,Enormous body size and toothless mouths,,,,"Sea Grasses, Algae, Flowers",,,,Sea Grasses,,,,,1,0,0
Stoat,"['Asia', 'Eurasia', 'Europe', 'North-America']",Animalia,Chordata,Mammalia,Carnivora,Mustelidae,Mustela,Mustela Erminea,,,,,,,,,Moorland and woodlands,Carnivore,8,Solitary,,,,Average adults weigh about 200 grams!,,BrownBlackWhiteTan,Fur,20 mph,4-6 years,200-500g (7-17.6oz),,,,,"Fox, Snake, Wild Cats",Mammal,,,,,,"Rabbits, Mice, Insects",,,,Rabbit,,,,,1,0,0
Striped Hyena,"['Africa', 'Asia', 'Europe']",Animalia,Chordata,Mammalia,Carnivora,Hyaenidae,Hyaena,Hyaena hyaena,Small insects and small animals,Cub or pup,Small families,"5,000 to 14,000 worldwide.",Humans and human activities,Stripes on their bodies,,90-92 days,"Deserts, semi-deserts, woodlands, scrub forests, acacia bushlands, grasslands, tropical savannas, and rocky terrains",Omnivore,,,Striped Hyena,,"Africa, West India, the Middle East, and the Arabian Peninsula",,Solitary or in pairs,GreyBlackBeige,Fur,5 mph,24 years in captivity,57 to 90 pounds,1 – 1.15 meters in length. Their tail measures about 12.5 inches,2-3 years old,8 months to 1 year,2 to 4 cubs,"Humans, lions, other big cats",Mammal,1 – 1.15 meters in length. Their tail measures about 12.5 inches,,,,,,,,,,,,,,1,0,0
Sugar Glider,['Asia'],Animalia,Chordata,Mammalia,Diprotodontia,Petauridae,Petaurus,Petaurus breviceps,"Insects, tree gum, sap",joey,Colony,,Habitat loss,Web membranes,,15 Days,"Forest, woodlands",Omnivore,,, Sugar glider,,"Australia, Indonesia",,,GreyBlackWhite,Fur,,120 months,0.1kg-0.25kg (0.25lbs-0.5lbs),0.15m-0.22m (0.5ft-0.75ft),1 year,3 months,1-2,"Owls, cats, snakes",Marsupial,,,,,,,,,,,,,,,1,0,0
Sumatran Elephant,['Asia'],Animalia,Chordata,Mammalia,Proboscidea,Elephantidae,Elephas,Elephas Maximus Sumatranus,,,,,,,,,Rainforest and tropical woodland,Herbivore,1,Herd,,,,"Less than 2,000 left in the wild!",,BrownGreyBlack,Leather,27 mph,55 - 70 years,"3,000kg - 5,000kg (6,500lbs - 11,000lbs)",,,,,"Human, Tiger",Mammal,2m - 3m (7ft - 10ft),Long trunk and large feet,,,,"Grass, Fruit, Roots",,,,Grass,,,,,1,0,0
Sumatran Orang-utan,['Asia'],Animalia,Chordata,Mammalia,Primates,Hominidae,Pongo,Pongo abelii,"Fruits, Shoots, Insects",Infant,Solitary,"4,000",Hunting and habitat loss,"Long arms and long, orange hair","Red Ape, Forest Person",9 months,"Dense, tropical forest",Omnivore,1,Diurnal,Sumatran Orang-utan,1.0,Northern Sumatra,Known to make mental maps of the forest!,Mammal,BrownGreyRedOrange,Hair,2.7 mph,30 - 40 years,30kg - 82kg (66lbs - 180lbs),,12 - 15 years,3 years,,"Sumatran Tiger, Humans",,1.25m - 1.5m (4ft - 5ft),,,,,,,,,,,,,,1,0,0
Sumatran Rhinoceros,['Asia'],Animalia,Chordata,Mammalia,Perissodactyla,Rhinocerotidae,Dicerorhinus,Dicerorhinus Sumatrensis,,,,,,,,,"Tropical bushland, grassland and savannas",Herbivore,1,Solitary,,,,The smallest species of rhino!,,BrownGreyBlack,Leather,30 mph,30-45 years,"500kg - 800kg (1,100lbs - 1,760lbs)",2m - 2.5m (6.6ft - 8.2ft),,,,"Human, Wild cats",Mammal,,,,,,"Grass, Fruit, Berries, Leaves",,,,Grass,,,,,1,0,0
Sumatran Tiger,['Asia'],Animalia,Chordata,Mammalia,Carnivora,Felidae,Panthera,Panthera Tigris Sumatrae,,,,,,,,,Dense tropical forest,Carnivore,3,Solitary,,,,The smallest species of tiger!,,BlackWhiteOrange,Fur,60 mph,18 - 25 years,80kg - 150kg (176lbs - 330lbs),,,,,Human,Mammal,,,,,,"Deer, Cattle, Wild Boar",,,,Deer,,,,,1,0,0
